{
  "id": "fish-oil",
  "name": "Fish oil (EPA/DHA)",
  "category": "micronutrient",
  "forms": [
    "softgel",
    "liquid"
  ],
  "delivers": [
    {
      "compoundId": "epa"
    },
    {
      "compoundId": "dha"
    }
  ],
  "suitableFor": [
    "omnivore",
    "pescatarian"
  ],
  "allergens": [
    "fish"
  ],
  "review": {
    "status": "expert_reviewed",
    "reviewedBy": "Jess",
    "reviewedOn": "2026-09-05"
  },
  "notes": "Split out from the old combined omega-3 record. Fish oil and algal oil are now two ingredients delivering the same compound group, which is what makes the vegan path a lookup rather than a special case."
}
