{
  "id": "plant-protein-blend",
  "name": "Plant protein blend (pea + rice)",
  "category": "protein",
  "forms": [
    "powder"
  ],
  "delivers": [
    {
      "compoundId": "protein-complete",
      "typicalConcentration": 0.75
    },
    {
      "compoundId": "leucine",
      "typicalConcentration": 0.07
    }
  ],
  "suitableFor": [
    "omnivore",
    "vegetarian",
    "eggetarian",
    "vegan",
    "pescatarian",
    "other"
  ],
  "allergens": [],
  "review": {
    "status": "expert_reviewed",
    "reviewedBy": "Jess",
    "reviewedOn": "2026-09-05"
  },
  "notes": "Added in the v3 migration as the vegan counterpart to whey. Pea+rice is blended specifically because each alone is limiting in an essential amino acid; the blend is treated as complete. Needs expert confirmation of the leucine figure before sign-off."
}
