{
  "id": "multivitamin",
  "name": "Multivitamin / multimineral",
  "category": "micronutrient",
  "forms": [
    "tablet",
    "capsule"
  ],
  "delivers": [
    {
      "compoundId": "vitamin-d3"
    },
    {
      "compoundId": "vitamin-b12"
    },
    {
      "compoundId": "vitamin-c"
    },
    {
      "compoundId": "vitamin-a"
    },
    {
      "compoundId": "folate"
    },
    {
      "compoundId": "iron"
    },
    {
      "compoundId": "zinc"
    },
    {
      "compoundId": "calcium"
    },
    {
      "compoundId": "magnesium"
    }
  ],
  "suitableFor": [
    "omnivore",
    "vegetarian",
    "eggetarian",
    "vegan",
    "pescatarian",
    "other"
  ],
  "allergens": [],
  "review": {
    "status": "draft_needs_expert_review",
    "reviewedBy": null,
    "reviewedOn": null
  },
  "notes": "Delivers many compounds at once, which is exactly why the dose ledger matters here: a user on a multivitamin who is also recommended a standalone D3 or iron needs the totals summed against the UL. Per-product amounts vary enormously, so the ingredient declares WHICH compounds without concentrations - the product record carries the numbers."
}
